"block","name","title","numberMissing","word1","word2","statement1","statement2","question","positive","negative","answer","type","format","immersion"
1,"neighbor-es","Encontrándote a un vecino",1,"distraído","None","Mientras caminas por una calle llena de gente, ves a tu vecino del otro lado. Lo llamas, pero no te contesta. En la calle, piensas que debe ser porque estaba distraído.","None","¿Tu vecino ignoró a propósito tu llamada en la calle?","No","Sí","Positive","Social","Visual","picture-es"
1,"dentist","El chequeo con el dentista",1,"sanos","None","Tienes una cita rutinaria con el dentista y descubres que necesitas algunas pruebas para revisar la salud de tus encías y dientes. Después de que el dentista realiza las pruebas, continúas reposando en la silla del dentista mientras esperas los resultados. Crees que tus dientes y encías probablemente estén sanos.","None","¿Crees que algo está mal con tus encías?","No","Sí","Positive","Physical_NonAnxSensitive","Visual","picture-es"
1,"chair","Una silla chirriante",1,"fruncidos","positivamente","Llegas a tiempo a una reunión en la mañana, pero ya todos los demás están ahí. Tus colegas de trabajo te miran sacar la silla y hace un ruido altisonante. Tus colegas te miran con los ceños fruncidos.","Al final, te das cuenta que tus colegas de trabajo sólo son buenos empleados y están entusiasmados para empezar la reunión. Durante la reunión, te respondieron positivamente.","¿Tus colegas de trabajo te juzgan negativamente?","No","Sí","Positive","Social","Visual","picture-es"
1,"language","El examen del curso de idioma",1,"inteligente","None","Como parte de un curso de idioma, debes tomar un examen oral. El material ha sido cubierto brevemente en clase y te pidieron hacer una investigación individual. Durante la clase, mientras esperas tu turno, sientes que la gente va a pensar que pareces ser inteligente.","None","¿La gente pensará que eres inteligente cuando presentes?","Sí","No","Positive","Social","Visual","picture-es"
1,"aid","El curso de primeros auxilios",1,"preparado","None","Has completado un curso de primeros auxilios y ahora debes tomar un examen práctico donde demuestres lo que aprendiste delante de tu clase. Pasaste la noche anterior practicando para este examen difícil. Cuando comienzas el examen, tus compañeros de clase que te observan piensan que no estás preparado.","None","¿Tus compañeros de clase piensan que estás preparado para el examen?","Sí","No","Negative","Social","Visual","picture-es"
1,"section-es","Entregando un trabajo",1,"pases","None","Estás tomando una clase y recientemente entregaste un trabajo. Decides volver a leer el documento enviado y te das cuenta de que eliminaste accidentalmente una sección que tenías la intención de incluir en el trabajo. Dado que accidentalmente realizaste esta eliminación, crees que probablemente pases.","None","¿Vas a obtener una calificación aprobatoria en el trabajo?","Sí","No","Positive","Other","Visual","picture-es"
1,"shaky","Anticipando una entrevista",1,"emocionado","None","Te están entrevistando para un trabajo muy bueno. Antes de entrar al cuarto, te das cuenta de que te sientes tembloroso. Te sientes increíblemente emocionado.","None","¿Te da miedo sentirse tembloroso?","No","Sí","Positive","Physical_AnxSensitive","Visual","picture-es"
1,"traffic","Tarde para la cena",1,"tráfico","None","Vas a reunirte con tus padres para cenar. Llegas al restaurante y todavía no han llegado, lo cual es extraño porque normalmente llegan a tiempo. Probablemente lleguen tarde debido al tráfico.","None","¿Tus padres tuvieron un accidente de carro?","No","Sí","Positive","Other","Visual","picture-es"
1,"report-es","Escribiendo un informe",1,"positiva","None","Tu supervisor te pide escribir un informe. El informe completo es muy corto pero te tomó mucho tiempo y esfuerzo. Basado en tu escritura, esperas que la opinión de tu supervisor sobre ti sea positiva.","None","¿Esperas que tu jefe tenga una opinión positiva de ti después de leer tu informe?","Sí","No","Positive","Social","Visual","picture-es"
1,"bus","Alcanzando la parada del autobús",1,"sentado","None","Es lunes por la mañana y te apresuras para llegar a la parada del autobús. Sientes tu corazón latir rápidamente mientras entras al autobús y te sientas. Temiendo a que te vaya a dar un ataque de pánico, tienes un impulso fuerte de salir del autobús y aún así decides observar esas sensaciones sin reaccionar y te quedas sentado.","None","¿Es necesario salir del autobús porque sientes tu corazón latiendo rápidamente?","No","Sí","Positive","Physical_AnxSensitive","Visual","picture-es"
2,"haircut","Un corte de pelo diferente",1,"bien","None","Estando en la peluquería decides irte por un corte de pelo completamente diferente. Después, cuando ves a tus amigos, se expresan con asombro. Sus expresiones probablemente signifiquen que piensan que el nuevo estilo te hace ver bien.","None","¿A tus amigos le gusta tu corte de pelo nuevo?","Sí","No","Positive","Social","Visual","picture-es"
2,"audition","Audicionando para una obra",1,"preocupa","None","Vas a hacer una audición para una obra de teatro. Sientes un temblor en tu cuerpo. Hay gente cerca de ti y te preocupa.","None","¿Te alegra que haya otras personas cerca cuando te sientes tembloroso?","Sí","No","Negative","Physical_AnxSensitive","Visual","picture-es"
2,"outfit","Pensamientos sobre tu vestimenta",1,"elegante","None","Llegas a una fiesta con un atuendo nuevo. Todos te voltean a ver al entrar. Decides que es porque deben pensar que te ves elegante.","None","¿A todos en la fiesta les gustó tu nuevo atuendo?","Sí","No","Positive","Social","Visual","picture-es"
2,"radio","Manejando con la radio puesta",1,"diferentes","conocedor","Estás en el carro con tu suegra y prendes la radio. Mientras discuten cuál estación escuchar, te das cuenta que tu suegra y tú tienen gustos musicales completamente diferentes.","Después de tener una discusión sobre los pros y los contras de diferentes estilos musicales, te das cuenta de que probablemente a ella no le importe que tus gustos entren en conflicto y simplemente te vea como conocedor.","¿Tu suegra piensa que no sabes nada sobre la música?","No","Sí","Positive","Social","Visual","picture-es"
2,"ocean","Un vuelo internacional",1,"emocionado","None","Vas a viajar a otro país. Durante el vuelo, miras por la ventana y te das cuenta que nunca has estado tan arriba del mar. Te sientes emocionado.","None","¿Estar tan alto te emociona?","Sí","No","Positive","Other","Visual","picture-es"
2,"sick","La cita con la doctora",1,"temporal","None","Te has sentido un poco mal recientemente y agendas una cita con la doctora. La cita más próxima es en un par de días. Mientras esperas la cita con la doctora, piensas que tu enfermedad es probablemente temporal.","None","¿Crees que te sentirás mejor pronto?","Sí","No","Positive","Physical_NonAnxSensitive","Visual","picture-es"
2,"creative","La clase de escritura creativa",1,"entusiasma","None","Una amiga sugiere que vayas a una clase de noche sobre escritura creativa. Revisas en línea y lees sobre la clase. A medida que navegas por el sitio, la idea de que otras personas vean tu escritura te entusiasma.","None","¿Esperas sentirte incómodo si otros miran tu trabajo?","No","Sí","Positive","Social","Visual","picture-es"
2,"coworkers","Asistiendo a una cena",1,"interesante","None","Tu pareja te pide ir a una cena con sus colegas de trabajo. No has conocido a estas personas antes y te preguntas qué pensarán de ti. Mientras te alistas para irte, piensas que la gente nueva te encontrará interesante.","None","¿No le agradarás a tus nuevos conocidos?","No","Sí","Positive","Social","Visual","picture-es"
2,"apartment","Comprando para una fiesta",1,"aceptarlo","None","Eres co-anfitrión de una cena en el apartamento de tu amigo y acabas de terminar todas las compras. Empiezas a sudar y sientes que tu corazón late con fuerza después de un par de viajes cargando las compras al tercer piso. Te sientes un poco asustado por estas sensaciones. Inseguro de si son buenas o malas, decides simplemente aceptarlo.","None","¿Puedes aceptar el latido rápido de tu corazón como algo ni bueno ni malo?","Sí","No","Positive","Physical_AnxSensitive","Visual","picture-es"
2,"degree-es","Regresando a la escuela",1,"mínima","None","Decides regresar a la escuela por otro título. Aunque has estado ahorrando en los últimos años para esto, te preocupas por no tener ingresos mientras estás de regreso en la escuela. La probabilidad de que quedes en bancarrota mientras estés en la escuela es mínima.","None","¿Te quedarás en la bancarrota una vez que regreses a la escuela?","No","Sí","Positive","Other","Visual","picture-es"
3,"movie","Mareos en el cine",1,"chistosa","None","Estás viendo una película en el cine. Hay muchas tomas de la cámara que te hacen sentir mareado. La sensación es chistosa.","None","¿Te preocupa cuando te sientes mareado?","No","Sí","Positive","Physical_AnxSensitive","Visual","picture-es"
3,"department","Presentación departamental",1,"manejables","None","Necesitas dar una presentación a otro departamento para el trabajo. Mientras piensas en la presentación sientes mariposas en tu estómago. La mañana de la presentación te sientes nervioso y piensas que tus nervios serán manejables.","None","¿Puedes tolerar tu ansiedad?","Sí","No","Positive","Social","Visual","picture-es"
3,"night","Levantarse de noche",1,"observarás","None","Es medianoche y te despiertas abruptamente. Mientras te sientas te sientes raro, como si tu mente no funcionara bien, y comienzas a pensar que podrías estar volviéndote loco. Este pensamiento te asusta y, al recostarte, decides que simplemente lo observarás.","None","¿Necesitas pelear con tus sentimientos raros para calmar tu ansiedad?","No","Sí","Positive","Physical_AnxSensitive","Visual","picture-es"
3,"babysitting","Cuidando a un niño",1,"bien","None","Estás cuidando un niño y él está jugando afuera con sus amigos. Miras por la ventana para ver cómo andan y no están ahí. El niño probablemente está bien.","None","¿El niño está bien?","Sí","No","Positive","Other","Visual","picture-es"
3,"interns","Los nuevos pasantes de verano",1,"quedarte","None","Tu jefe ha contratado a algunos pasantes para el verano. Tu jefe te pide que te quedes después del trabajo para darles una breve presentación sobre los objetivos y valores de la empresa, pero te dice que esto es completamente opcional. Te sientes un poco nervioso por dar la presentación y decides quedarte.","None","¿Te quedas para dar la presentación opcional?","Sí","No","Positive","Social","Visual","picture-es"
3,"guests","La invitación a una cena",1,"amigable","None","Un amigo te invita a una cena que está organizando. Te dice quiénes son los demás invitados, pero no reconoces ninguno de los otros nombres. De todos modos vas, y en el camino, piensas que los otros invitados te verán como una persona amigable.","None","¿Le caerás bien a la gente en la fiesta?","Sí","No","Positive","Social","Visual","picture-es"
3,"sign","Los amigos impuntuales",1,"irte","quedar","Llegas a una fiesta y notas que tus amigos aún no han llegado. Nadie te habla inicialmente y después de 30 minutos todavía no hay señal de tus amigos. Mientras terminas de comer algo en la cocina, te sientes consciente de ti mismo y decides irte.","Cuando te diriges a la puerta para salir, te das cuenta de que la gente de la fiesta probablemente también se siente un poco reservada. Regresas a la cocina y comienzas una conversación con dos personas que no conoces. Son amables y estás feliz de que te decidiste quedar.","¿Estás contento por quedarte en la fiesta?","Sí","No","Positive","Social","Visual","picture-es"
3,"mole","Un lunar en tu brazo",1,"preocupante","None","Te das cuenta de un lunar en tu brazo que no habías notado antes. Agendas una cita con el doctor para que lo examine. Mientras esperas tu cita, crees que el lunar es preocupante.","None","¿El lunar nuevo es una señal de cáncer?","No","Sí","Negative","Physical_NonAnxSensitive","Visual","picture-es"
3,"photo-es","La foto en las redes sociales",1,"avergonzado","web","Te invitan a una fiesta y decides ponerte un atuendo nuevo que no es tu estilo típico. Al día siguiente, ves que tu fotografía se publicó en un sitio web de redes sociales. El pensamiento de que todos vean tu foto te hace sentir avergonzado.","Al final, te das cuenta de que muchas personas se sienten avergonzadas al ver su propia imagen en público. Es probable que otras personas disfruten ver tu foto en las redes sociales del sitio web.","¿Esperas que otros vean tu foto en el sitio web?","Sí","No","Positive","Social","Visual","picture-es"
3,"grandmother-es","Llamando a la abuela",1,"ocupada","None","Todos los lunes llamas a tu abuela para saludarla. Hoy es lunes y no contestó el teléfono cuando le llamaste, lo cual es inusual. Tu abuela probablemente no contestó el teléfono porque está ocupada.","None","¿Tu abuela no puede hablar porque está enferma?","No","Sí","Positive","Other","Visual","picture-es"
4,"deadline-es","La tarea en un trabajo nuevo",1,"fracaso","progreso","Eres nuevo en un trabajo y tu jefa te pide que hagas una tarea. La terminas antes de la fecha límite y tu jefa inmediatamente te indica que cometiste un error. Tu jefa probablemente piensa que eres un fracaso.","Al final, te das cuenta de que tu jefa es rápida en darte comentarios porque está invirtiendo su tiempo en ti y está interesada en ver tu progreso.","¿Tu jefa cree que tu trabajo es prometedor?","Sí","No","Positive","Social","Visual","picture-es"
4,"boss","La reunión con tu jefe",1,"soportable","None","Hoy tienes una reunión individual con tu jefe intimidante, por lo que estás nervioso. Durante la reunión, pierdes momentáneamente el hilo de tus pensamientos. Después de eso, tu ansiedad es soportable.","None","¿Puedes tolerar tu ansiedad mientras te reúnes con tu jefe?","Sí","No","Positive","Social","Visual","picture-es"
4,"throat","Una garganta irritada",1,"sed","None","Al levantarte en la mañana, te das cuenta que tu garganta está más irritada de lo normal. Piensas sobre por qué puede ser esto. Decides que probablemente es porque tienes sed.","None","¿Beber agua hará que tu garganta esté mejor?","Sí","No","Positive","Physical_NonAnxSensitive","Visual","picture-es"
4,"paint","El hormigueo en los dedos",1,"chistosa","None","Estás ayudando a un amigo a pintar una casa y llevas mucho tiempo con la mano levantada. Empiezas a sentir el hormigueo en tus dedos. Esta sensación es chistosa.","None","¿La sensación de hormigueo en tus dedos te pone nervioso?","No","Sí","Positive","Physical_AnxSensitive","Visual","picture-es"
4,"economy","Las noticias sobre la economía",1,"bien","None","Recientemente has visto en las noticias que la economía está particularmente mala. Aunque tu jefe normalmente te da buenas críticas, te preguntas si tu trabajo está asegurado. Piensas que probablemente estarás bien.","None","¿Es probable que te vayan a despedir?","No","Sí","Positive","Other","Visual","picture-es"
4,"typo-es","Entregando un ensayo",1,"preocupado","None","Vas a entregar un ensayo. Mientras caminas, miras hacia abajo y te das cuenta de que hay un pequeño error tipográfico en la última página de tu trabajo. Crees que deberías estar preocupado.","None","¿Debes estar preocupado sobre el error tipográfico?","No","Sí","Negative","Other","Visual","picture-es"
4,"evaluation","La primera evaluación del trabajo",1,"excelente","None","Ha llegado la mañana de tu primera evaluación con tu nueva jefa. Te dice que tiene opiniones fuertes sobre tu trabajo. Piensas que probablemente encuentre tu trabajo excelente.","None","¿Piensas que tu jefa tiene una opinión no favorable sobre tu trabajo?","No","Sí","Positive","Social","Visual","picture-es"
4,"lecture","Espaciándote",1,"relajado","None","Estás en clase escuchando una conferencia. Dejas de prestar atención y te distraes por un minuto o dos. Cuando comienzas a prestar atención nuevamente, estás relajado.","None","¿Te sientes tranquilo después de dejar de prestar atención en la conferencia?","Sí","No","Positive","Physical_AnxSensitive","Visual","picture-es"
4,"topic-es","La clase interesante",1,"buena","None","Consideras tomar una clase nocturna en la que parte de tu calificación se basa en tu participación, aunque no te gusta hablar frente a los demás. Debido a que el tema es realmente interesante, decides inscribirte en la clase. Después de inscribirte, te das cuenta de que esta decisión fue buena.","None","¿Estás feliz de inscribirte en la clase nocturna?","Sí","No","Positive","Social","Visual","picture-es"
4,"colleagues","Escuchando tu nombre",1,"culpa","positivo","En el trabajo, escuchas a algunos colegas hablar sobre otras personas y escuchas que tu nombre fue mencionado. No escuchas todo lo que dicen, pero cuando caminas cerca de tus colegas, de repente miran hacia otro lado con culpa.","Después, te das cuenta de que muchas personas se involucran en chismes de oficina de vez en cuando y que tus colegas probablemente no quisieron hacerte sentir mal. De hecho, es posible que estuvieran diciendo algo positivo.","¿Tus colegas estaban diciendo cosas negativas sobre ti?","No","Sí","Positive","Social","Visual","picture-es"
